book_title,source,category,url,rating,text,ai_generated_label,ai_reasoning,label,reasoning,label_2,difficult
Never Flinch,LibraryThing,Horror,https://www.librarything.com/work/33198348/t/Never-Flinch,3.5,"Stephen King's latest novel, NEVER FLINCH, is the fourth book featuring Holly Gibney, a main character I both like and enjoy following. In great excitement, I preordered the audiobook, my favorite method of experiencing Mr. King's novels, and finally got down to listening to it. Only to discover that NEVER FLINCH is not one of Mr. King's strongest stories.

Holly Gibney has demonstrated tremendous growth over the first three books, excluding her role in Mr. King's Mr. Mercedes series. She has emerged from her timid and rigid shell to become a strong, decisive, fair, and competent character. For the most part, in NEVER FLINCH, Holly continues to exhibit those traits as she works to protect her client and solve a serial killer's murder spree in her spare time, until she doesn't. The switch from capable and decisive Holly to indecisive and fearful Holly is as abrupt as it is disconcerting. The whole shift is so out of character for Holly, especially the Holly as we now know her to be.

Holly's regression is particularly irksome because half of the plot surrounds women's rights. And, for most of the novel, she is a powerful woman in her own right. As a hired security guard for a feminist, it is as if Mr. King is emphasizing that Holly has grown into her role as a private investigator, business owner, and friend, and that she is no longer meek but wily, highly observant, and unafraid to act on intuition. Holly blends well with Kate McKay's bombastic nature, providing some much-needed calm against Kate's storm. Together, they are the perfect example of why women continue to fight for equal rights and against the patriarchy. Yet, Mr. King undoes that powerful portrayal in one short scene.

The issue here is that Mr. King did not need to betray Holly that way. I recognize that in this one scene, Holly's indecision becomes a crucial moment of suspense, akin to a bomb ticking down while someone waffles over which color of wire to cut. However, the scene does not need any more tension. The other threads of the story are also ratcheting up in suspense, building the necessary crescendo before the final confrontation between hero and villain. We don't need Holly to waffle; it doesn't add anything to the story. Instead, this one scene subtracts so much from who Holly has become.

Mr. King's novels always have multiple story threads, and he usually excels at coalescing them into one coherent finale. In NEVER FLINCH, the multiple stories don't quite work together. The build-up to the big fire versus police charity softball game is more distracting than anything. The Sista Bessie storyline is also a bit unnecessary. Don't get me wrong. Sista Bessie is a GREAT character, and I loved her scenes. But they didn't provide much other than a fun side story.

While NEVER FLINCH is one of Mr. King's more mediocre stories, I have to say the audiobook production is outstanding. As the narrator, Jessie Mueller provides a remarkable performance. She not only manages to embody prissy Holly, free-spirited Barb and Jerome, and blustery Kate, but she is glorious as Sista Bessie. Her singing is simply gorgeous. By the end of the novel, I forgot that she was narrating and thought that Sista Bessie was a real person. If ever there was an audiobook production you must experience, it is this one.

NEVER FLINCH is both a disappointment and a delight. I remain frustrated with how Mr. King showed Holly at the end of the story because I like her growth. It is why I keep coming back to the series. Holly has always been somewhat of an underdog, and this was the first novel where I felt that she was a reckoning force. To kick her back to where she started so suddenly like that is doing Holly a major injustice, and it was just too abrupt and unnecessary for me to be able to overlook it. Combine that with the side stories that were good entertainment but made a long novel feel even longer, and there are the disappointments. However, I enjoyed Jessie Mueller as Sista Bessie so much that I can only delight in her performance and relisten to those singing sections as often as possible! ",personal,Uses first-person language and references personal experiences or emotional reactions.,personal,Focuses on feelings,,FALSE
Never Flinch,LibraryThing,Horror,https://www.librarything.com/work/33198348/t/Never-Flinch,5,"👏👏👏 I absolutely loved this one! A relevant and impactful story beautifully woven with a suspenseful thriller. This is only my 6th read by King and I am always blown away by how amazing his writing is. Each novel is packed with details but in a way that I don’t find boring. It always adds to the story for me and makes for a great ending every time. I don’t know how to word my thoughts right now, but I especially loved Never Flinch because it takes place in today’s world and touches on a very intense and important topic: women’s rights: pro-choice. It made for a very political read, but in an enjoyable way with how thrilling the plot was. I feel like I learned a great deal about the topic through this book. Even though it wasn’t a main plot point, it still holds a significant spot throughtout the whole book becasue of one of the main characters.

Stepping away from said topic, I also really enjoy how horrific the writing was as well. Reading from the POV of the serial killer was quite unsettling, yet also intriguing. This lunatic killer was certainly a psychopath; and with that ending, I feel like there was something supernatural about it... Also, the fact that there are two crazies in here and we get both of there POVs 😵‍💫 As it turns out, I will definitely be reading King’s other books that have Gibney as a character, because I thoroughly enjoyed this one. Now, I just need to make sure I read them in the right order 😂 While I still feel like there’s so much more I want to say, I don’t want to ramble or spoil the story. Highly recommend",summary_heavy,Focuses on retelling the plot or describing what happens in the book.,analytical,Focuses on style,,FALSE
Never Flinch,LibraryThing,Horror,https://www.librarything.com/work/33198348/t/Never-Flinch,3,"Holly Gibney has a lot going on. She's informally helping out a detective friend with a serial killer case and she's been hired as a body guard for a feminist activist doing a speaking tour of the Midwest. Meanwhile, Jerome is struggling with his novel and Barbara is having the time of her life as she makes friends with a music legend who wants to turn one of Barbara's poems into a song.

This novel is where King moves the Finders Keepers crew away from horror and into the realm of the mystery series. And he knows all the rules of the genre and does a good job of keeping the tension high while never veering into horror or even allowing any of the main characters to be harmed. I'd say that this is a good book for those who want to read King but who don't like horror to jump in, but this book also has the long-standing relationships of a established series. Would the deep affection people hold for Holly Gibney make sense if you hadn't already read about what she had experienced previously?

King has some interesting and nuanced character studies in this book and he certainly knows how to pull off a big finish, but the plotting felt a little simpler than in the past. I figured out a clue immediately that had Holly and the police puzzled for far too long, and I never figure things out ahead of time. While I have liked this series far more than his usual work, I think that maybe King has grown to like his characters far too much to put them in harms way, which is to the detriment of this series. ",personal,Uses first-person language and references personal experiences or emotional reactions.,personal,Focuses on feelings,,FALSE
The Buffalo Hunter Hunter,GoodReads,Horror,https://www.goodreads.com/book/show/214565614-the-buffalo-hunter-hunter?from_choice=true,4,"I don't even really know where to begin. This is an outstanding horror novel, but it's not a pleasant read. It's enthralling, but it's not exactly enjoyable. The historical bits are interesting, but they're also awful. I read the last 40% in one sitting because I was so invested in the story, but I was disgusted by pretty much all of it. So did I love it or did I hate it? Well, a little bit of both, I think.

First off, the trigger warnings: Well, there's death and death and more death. Human death. Animal death. Like, so much death. And it's all traumatic and gory and terrible. Most of the animal deaths are wild animals and not pets, if that makes a difference to anyone.

The text is a little confusing at times. There are Pikuni words and their anglicized counterparts used constantly, and they're often not explained immediately (or at all, in some cases). Heck, I still don't know the identity of half of the animals that Good Stab kept mentioning. I also highly recommend reading the Wikipedia articles on the Piegan Blackfeet and the Marias Massacre before starting this novel – I read them after the fact, and wish I would have sought them out earlier. The summaries really helped with some terminology and also with understanding the details of and the “whys” behind the horrible events of this book.

And that's part of what makes this novel so difficult to read, I think: these events actually happened. I mean, not the vampire bits, of course, but the rest of it. The Pikuni are real people and the Marias Massacre really did happen. The buffalo were hunted almost to extinction and the Pikuni did starve because of it. Native Americans were forced onto reservations by the United States government. When you look at it from a historical point of view, Good Stab's actions start to make a lot more sense. Stephen Graham Jones really did an amazing job of weaving actual history into his fictional tale.

The supernatural aspects of this story are pretty well laid out in the blurb: a Pikuni vampire seeks revenge for the decimation of the buffalo and his people. Jones's writing is atmospheric and creepy, and I appreciated his fresh take on vampire lore. Good Stab is a morally gray character, but it's not hard to feel sympathy for him and his plight.

Overall, The Buffalo Hunter Hunter isn't a fun read or even necessarily an enjoyable one, and the subject matter is dark and difficult to stomach at times. However, it's also enthralling and well-written, and it sheds some much-needed light on a truly awful chapter in American history. If you enjoy horror and historical fiction and can handle the violence and death that permeates this novel, definitely consider giving it a read. ",summary_heavy,Focuses on retelling the plot or describing what happens in the book.,analytical,Goes over novel language and author choices,,FALSE
The Buffalo Hunter Hunter,GoodReads,Horror,https://www.goodreads.com/book/show/214565614-the-buffalo-hunter-hunter?from_choice=true,5,"Horror hits differently when it’s built on the bones of real, genocidal history. The blood, viscera, and supernatural vampire horror is plentiful in The Buffalo Hunter Hunter but it pales in comparison to the real horror story: the brutality of colonisation, the events of the Marias Massacre, and the hunting of the buffalo to near extinction.

The Buffalo Hunter Hunter dredges up the historical truth of the massacre, reminding us of the ways history is often written by the victors/colonisers, and consequently sanitised, whitewashed or buried. We get the story through three different perspectives: the eyes of a Blackfeet named Good Stab, a Lutheran pastor and a professor seeking tenure at the University of Wyoming.

The book is a reckoning, an excavation of memory and trauma wrapped in the intimacy of Good Stab’s confessional-style recordings. The epistolary format makes it feel almost voyeuristic, like I’ve stumbled onto something not meant for outside eyes.

Initially, the language of Good Stab took time for me to settle into, because it wasn’t diluted for convenience. There’s no glossary, no hand-holding, no neat little footnotes.

Instead, I had to work for my understanding. It’s a deliberate artistic choice by SGJ, and one I respect and revere. My interpretation is that the language is something to be felt, experienced, understood through context and immersion. The effort you put in to adapt to the flow makes the emotional payoff all the richer.

Additionally, The Buffalo Hunter Hunter is not an easy read, nor should it be. Some books exist to comfort, to provide escape. This one exists to confront the carnage that history books so often obscure. The sheer amount of blood, brutality, both against people and animals, is staggering, so be mindful of the content warnings. This book doesn’t just shock, it opens up a wound that never really healed. And that's a history we can’t afford to forget, no matter how ugly it gets.

I’m going to have to add SGJ officially to my favourite list of horror writers. Obviously I recommend this one highly. But that recommendation comes with a warning for a gut-wrenching, painful, but necessary read for understanding the true weight of history.",personal,Uses first-person language and references personal experiences or emotional reactions.,analytical,Goes over author style,,FALSE
The Buffalo Hunter Hunter,GoodReads,Horror,https://www.goodreads.com/book/show/214565614-the-buffalo-hunter-hunter?from_choice=true,2,"Ok, let the outlier castigation begin…

I know words. I speak them, hear them, read them, write them. I even eat them quite often. But these words were not parsable for my disordered brain. This prose is so inaccessible for me. I felt like a child trying to understand an adult conversation about the weight of moral ineptitude on the fabric of society.

I spent ALL of my time with this book trying to make sense of the last sentence, never looking forward to the next. When I do that, I lose complete track of what’s happening in the story. None of this was enjoyable to me.

I admire its boldness and storytelling audacity. I’m glad that so many people love it, and I appreciate that it’s strengthening the genre. It’s just not for me, and I think that probably says more about me than this clearly gifted author.

On to the next one…",personal,Uses first-person language and references personal experiences or emotional reactions.,reactive,Strong opinion,,FALSE
The Buffalo Hunter Hunter,The StoryGraph,Horror,https://app.thestorygraph.com/book_reviews/f8d4df4b-9b60-4163-a104-ff8f0ba28f5f,5,"“What I am is the Indian who can’t die. I’m the worst dream America ever had.”

Going into this novel, I was obnoxiously confident that I already knew the story: a Western. An Indigenous vampire. A tale of revenge against white colonists.

Nope.

Nothing could’ve prepared me for the intense guttural experience this book actually had.

Rather than delivering the story I expected, Stephen Graham Jones throws predictability out the window and crafts a narrative where the true horror lies not only in the supernatural, but in history itself. Brutal, haunting, and deeply human, Buffalo Hunter Hunter confronts the realities of colonisation with a force that few horror novels I’ve read have ever achieved.

Read it. Now. ",summary_heavy,Focuses on retelling the plot or describing what happens in the book.,reactive,Strong opinion,,FALSE
The Buffalo Hunter Hunter,The StoryGraph,Horror,https://app.thestorygraph.com/book_reviews/f8d4df4b-9b60-4163-a104-ff8f0ba28f5f,4.75,"Dark, character driven. Interview with a vampire esque from the native perspective. As with, The Only Good Indians, Graham Jones needs a build up to his story. But once he’s there, the plot keeps going; you can’t stop. Each character voice feels unique and continues to drive the plot. Haunting in multiple ways. Can’t wait to check out his next big work.",summary_heavy,Focuses on retelling the plot or describing what happens in the book.,analytical,Analyzes author's style,,FALSE
The Buffalo Hunter Hunter,The StoryGraph,Horror,https://app.thestorygraph.com/book_reviews/f8d4df4b-9b60-4163-a104-ff8f0ba28f5f,1,"What a disaster of a book, lol. Operating on three levels of epistolary narrative, in the year 2012, communications professor Etsy Beaucarne is transcribing and writing commentary on her great-great-great-grandfather Arthur Beaucarne's journal, written in 1912, in which he transcribes word-for-word the autobiographical stories of Good Stab, a Blackfeet man who got turned into a vampire in the late 1800s. The three narrators are barely distinguishable in terms of personality, though they do use different vocabulary, if nothing else. It's a gory little adventure in which basically nothing happens, but boy does it take a long time to not happen.

The bulk of the narrative is taken up by Good Stab's trials and tribulations trying to survive as a vampire, especially when his particular flavor of vampirism means that he takes on the physical characteristics of the things he eats. Although he can survive on non-human animals, if he does so exclusively, he'll cease to be recognizably humanoid at all. One would be tempted to think that this would serve as an interesting commentary of some sort, perhaps on assimilation or colonial violence, especially given that even within ""humanity"" as a class, he does gain the features of white people when he eats them (light hair and skin, facial hair, etc.), which means he is forced to kill and eat his own people in order to maintain an appearance that matches his identity. It doesn't serve any such purpose. The vampirism is in fact totally unnecessary and shallow. It is more of a cool idea and a vehicle for blood and gore than it is a meaningful element of the story. Good Stab makes some references to being shunned and exiled as a result of his vampirism, but this isn't actually depicted and a different vampire later infiltrates his tribe no problem despite being much more suspicious and a stranger, so... ??? Anyway, he uses his vampire powers to take vengeance on white hunters killing all the buffalo for fur trade, thus the title of the book.

Arthur Beaucarne's sections of the narrative are by far the least necessary and coherent. He really doesn't have a personality at all. He's nominally a proud racist and judgmental personally to boot, but he has nothing for respect for Good Stab to the point of faithfully recording his narrative with no commentary or alterations simply because he believes it's important for posterity (why? for that matter, how?). He at some point becomes frightened for his life somewhat arbitrarily, but that doesn't actually meaningfully change his behavior with relation to Good Stab when they interact. He also bizarrely steals a cat from a brothel on a whim at one point, after which it becomes his close companion and a major emotional crux of his character. Like... what? Late in the narrative, the fact that he was personally involved in the massacre of the Blackfeet in 1870 is treated like it's some kind of huge twist, when I cannot imagine another reason Good Stab would be talking to and menacing him. I didn't realize this was supposed to be shocking until the other characters reacted as though it was a surprise. Plot and personality aside, the most egregious part of these sections is that the ""antiquated"" vocabulary and register reads absolutely nothing like actual early 20th century writing in style or tone, complete with frequent misuse of any even slightly unusual vocabulary. Suffice it to say, I was appalled but not surprised to read in the acknowledgements that his diction was aped, not from any period writing or research of any kind, but from, I kid you not, Thor comics. Stay classy.

And finally, the book begins and ends with Etsy, who is nominally 43 years old and a college professor, who writes and acts like a particularly ignorant and incurious teenager. She is an irrepressible braggart, which really undercuts the tension we're supposed to be feeling in this ostensibly-horror novel. It's hard to get scared when she's interrupting her own panicked writing to point out her own clever wordplay. There is one notable moment where she explicitly switches from typing out her thoughts (unclear why she is doing this at all, for the record, since by that point in the story, her proposal for this academic project has been shot down) to recording her voice, and there is no shift whatsoever in tone, vocabulary, or structure. It betrays utter thoughtlessness and disrespect for the medium of the book.

For all three narrators, you cannot go longer than a paragraph or two without some inane quip getting separated out into its own paragraph for emphasis. It leads to the entire book sounding both amateurish and smug. I wish the smugness had been warranted, but it's really content-free thematically. It doesn't even work as a straightforward revenge fantasy because too much time is spent with Etsy and Arthur trying to (I assume) make them sympathetic to the audience so that their fear of Good Stab serves as tension to hold up the horror elements of the book. The narrative is at odds with itself at every turn in a way that makes every single element fall flat. It is a slog to read and has nothing to say while it's slogging.

By the way, ""tresayle,"" which is an old-timesy word the end of the book uses incessantly because Etsy is determined to mock one of her coworkers for being unimpressed with her work even while she believes she's being hunted by a vampire, does not mean great-great-great-grandfather. It means great-great-grandfather. You would think somebody would have noticed, but there are a lot of things you would think somebody would have noticed in this one.

Did you know this thing won multiple awards? Boy, literary criticism has become a joke these days.",summary_heavy,Focuses on retelling the plot or describing what happens in the book.,summary_heavy,Focuses on plot,,FALSE
The Buffalo Hunter Hunter,LibraryThing,Horror,https://www.librarything.com/work/32735875/t/The-Buffalo-Hunter-Hunter,3.5,"Creepy, wildly gory, atmospheric, and with a stack of framing devices hardly seen since Wuthering Heights. A tale of the horrors of experiencing the colonization of the Americas as an indigenous person, stacked inside a story of vampires, revenge, and religious horror, stacked inside a kind of horror version of A.S. Byatt's Possession. The very ending section kind of took me out of everything a bit—the tone got a little too wacky and ended up being way more funny than scary, for me (your mileage may vary—for a time my mother kept a prairie dog as a pet, which may be a factor).",summary_heavy,Focuses on retelling the plot or describing what happens in the book.,summary_heavy,Goes over the plot,,FALSE
