book_title,source,category,url,rating,text,ai_generated_label,ai_reasoning,label,reasoning,label_2,difficult
The First Witch of Boston,GoodReads,Historical Fiction,https://www.goodreads.com/book/show/222794853-the-first-witch-of-boston,5,"Gorgeously written and deeply researched, THE FIRST WITCH OF BOSTON is a compelling, intimate portrait of a marriage—and of an independent woman dangerously ahead of her time. The tragedy Catalano unfolds in this exceptional debut novel will break your heart, and remains all too relevant in a world where The Handmaid’s Tale has become uncomfortably predictive. Highly recommended. ",reactive,Expresses a strong opinion without supporting details or personal grounding.,summary_heavy,Reads like a summary,,FALSE
The First Witch of Boston,GoodReads,Historical Fiction,https://www.goodreads.com/book/show/222794853-the-first-witch-of-boston,4,"The story of Maggie Jones, the first woman to be executed for witchcraft in the Massachusetts Bay Colony, begins from the point of view of her husband, Thomas Jones. This was a most unique way of telling the story.

Too often the story of women being on trial for witchcraft is told from the perspective of the woman and the husbands are nothing more than a side note. To read how Thomas dealt with the suspicions and accusations thrown about, regarding the woman he loved dearly, was refreshing. I found this approach to telling the story to be what kept me turning the pages.

While the main point of the novel is the history of a strong, intelligent, outspoken woman being killed for being strong, intelligent and outspoken it is also a novel about the depth of love. Catalono weaves a love story that describes how two people can come so completely together. Additionally, the love of parents for a child and the love between friends are beautifully done.

Students of early American history are aware of the hypocrisy that was part of the Puritans in New England, but Catalano puts it into the forefront. Not all Puritans were so pure!

With very little information in the historical record of Maggie and Thomas Jones, Catalano had to fill in the blanks. True, she altered where Maggie was born and how she was raised, but this made the story have more depth. I do not begrudge the fictional license Catalano took.",summary_heavy,Focuses on retelling the plot or describing what happens in the book.,summary_heavy,Focuses on plot,,FALSE
The First Witch of Boston,The StoryGraph,Historical Fiction,https://app.thestorygraph.com/book_reviews/2979f0ac-a592-457c-899f-bbe6f9398a7b,3,"This was a break from the genres of books I usually read, but as a Massachusetts resident and history fan I felt inspired to reach out when I found this on a great sale. 
Ultimately, it didnt wow me. The writing was very good, but it got a little repetitive after a while. Of course, I have to assume that it was authentic to the way that this would've gone down in the past, but it just didnt make for a super engaging read. I liked it, but I didnt love it:",personal,Uses first-person language and references personal experiences or emotional reactions.,personal,Focuses on personal experience,,FALSE
The First Witch of Boston,The StoryGraph,Historical Fiction,https://app.thestorygraph.com/book_reviews/2979f0ac-a592-457c-899f-bbe6f9398a7b,2.5,"I really liked that there were actual journal entries and it felt more realistic than other Salem witch trials stories and I was annoyed. It felt like the characters were having the same problems over and over again which made the story drag for me. 

Maggie was outspoken and stood up for herself, her clients got mad, her husband got mad. The cycle was annoying and sometimes her husband was real dumb. ",personal,Uses first-person language and references personal experiences or emotional reactions.,personal,Focuses on feelings,,FALSE
The First Witch of Boston,The StoryGraph,Historical Fiction,https://app.thestorygraph.com/book_reviews/2979f0ac-a592-457c-899f-bbe6f9398a7b,3,"‘“Indeed, Goodman Endecott, Lord help you all, all of you, this day. Got you are about to execute an innocent woman. You are about to execute an innocent woman for the crime of being a woman, a woman who lived fully, spoke plainly, listened intently, observed acutely, intuited wisely, loved passionately. I am too much for this world of yours this Jerusalem upon a hill.” I spat upon the ground. “I am a force that makes you quake!”’",reactive,Expresses a strong opinion without supporting details or personal grounding.,reactive,Strong opinion,,FALSE
The First Witch of Boston,LibraryThing,Historical Fiction,https://www.librarything.com/work/34568833/t/The-First-Witch-of-Boston-A-Novel,4,"I really liked Maggie in The First Witch of Boston. She’s sharp-tongued, smart, and always helping everyone around her as a healer. That’s what makes her story so heartbreaking — even after everything she did for her community, she was still accused and tried as a witch.

Her relationship with Thomas adds a lot of heart, and the book does a great job showing the pressure, fear, and unfairness she faced. It’s a quick but emotional read, and definitely worth it if you enjoy historical fiction centered on strong, resilient women.",summary_heavy,Focuses on retelling the plot or describing what happens in the book.,summary_heavy,Focuses on characters,,FALSE
The First Witch of Boston,LibraryThing,Historical Fiction,https://www.librarything.com/work/34568833/t/The-First-Witch-of-Boston-A-Novel,3,"""The First Witch of Boston"" was a historical novel inspired by true events. I’ve always been interested in the Salem Witch Trials, so I thought this book sounded interesting. The story follows Thomas Jones and his wife Maggie, tracing their life together in Boston, the accusations of witchcraft against Maggie, and the tragic path that leads to her execution.

Told in two halves, the first was from Thomas’ point of view, focusing on their life in Boston and what led to Maggie’s arrest for witchcraft. Thomas was a carpenter - solid, calm, kind, good-hearted and steady and, the perfect man for his hot-headed wife.

The second half shifted to Maggie’s point of view and followed her trial through to the day of her hanging. Maggie was portrayed as a healer, midwife, and herbalist - outspoken, passionate, intuitive, fiery and intelligent. Her strength and defiance were central to the story, and her voice was more emotionally charged than Thomas’s, though not always easy to like.

I thought the novel dwelt far more on the love between Thomas and Maggie than on the wider historical context. While their relationship was clearly meant to be the emotional core, this came at the expense of a stronger sense of time and place. The book lacked the texture of daily life in colonial Boston (clothing, food, smells, sounds, etc.), which made the setting feel thin. The writing also felt too modern for the time period, pulling me out of the story more than once.

Despite knowing exactly how the book would end, it was still heartbreaking to read, especially with the reminder that many innocent women were killed in the name of witchcraft, thanks to pompous, narrow-minded men threatened by women who ""didn’t know their station in life"". That underlying injustice was powerful, even if the execution of the story was uneven.

Overall, I found it hard to truly like most of the characters, and the pacing was slow. Still, an interesting read, but not a compelling one.",personal,Uses first-person language and references personal experiences or emotional reactions.,personal,Focuses on feelings,,FALSE
The First Witch of Boston,LibraryThing,Historical Fiction,https://www.librarything.com/work/34568833/t/The-First-Witch-of-Boston-A-Novel,5,"It was so good, I enjoyed reading the book.

It makes you think about how these poor women who were smart and/or voiced their opinion were thought to be witches.",reactive,Expresses a strong opinion without supporting details or personal grounding.,reactive,no supporting details or grounding,,FALSE
Not Quite Dead Yet,GoodReads,Mystery & Thriller,https://www.goodreads.com/book/show/220223963-not-quite-dead-yet,4,"Really enjoyed this book!! I LOVE the concept. Holly Jackson's most unique and highest stakes book imo. I love that this book is SUCH a great balance of comedic relief through Jet's dark humor but also heartbreaking at moments because she only has 7 days left to live.
The only two things stopping me from rating this book higher is 1. although I loved Jet & Billy, I didn't feel super emotionally connected to them. 2. Never saw the ending coming but I do think I have read twistier mysteries before.
And now I've read every Holly Jackson book!!
My current ranking of Holly Jackson's books:
1. A Good Girls Guide to Murder series OF COURSE
2. Five Survive - LOVE this one
3. Note Quite Dead Yet
4. The Reappearance of Rachel Price",summary_heavy,Focuses on retelling the plot or describing what happens in the book.,personal,Focuses on feelings,,FALSE
Not Quite Dead Yet,GoodReads,Mystery & Thriller,https://www.goodreads.com/book/show/220223963-not-quite-dead-yet,1,"- This should have been YA, because it certainly reads that way.
- A bunch of F-bombs doesn't make a book adult.
- Jet is a stupid name.
- She's constantly repeating how someone murdered her, how she'll solve her own murder, or some version of that, and it gets awfully tiring.
- Characters are one-dimensional and none of them sound like a mature adult, lead character included.
- Audio book narration is torture. Male voices are atrocious.
- For a thriller, there's really nothing thrilling.",reactive,Expresses a strong opinion without supporting details or personal grounding.,reactive,Strong opinion,,FALSE
Not Quite Dead Yet,GoodReads,Mystery & Thriller,https://www.goodreads.com/book/show/220223963-not-quite-dead-yet,5,"Who thought I would end up sobbing over a murder mystery? Holly, you’re gonna pay for my therapy 🤧✋🏻",reactive,Expresses a strong opinion without supporting details or personal grounding.,reactive,Strong opinion,,FALSE
Not Quite Dead Yet,The StoryGraph,Mystery & Thriller,https://app.thestorygraph.com/book_reviews/3920f3cd-f2fb-4ef9-b9be-cda82067af1c,4.25,"Holy shit???!? This book made me smile, laugh, cry, yell in anger and frustration and left me speechless all within 430 pages… I don’t know if I like the ending per se, aka, the scene where Luke kills Jack Finney and Billy in his thoughts is like: ‘Not the ending he’d planned, but an ending he could live with. Because he was the one who had to live. For Jet.’ It didn’t feel realistic to me. I’d be in complete shock but still cry because my Dad was murdered right in front of my eyes. but I give it a well-deserved 4,25 stars!!",summary_heavy,Focuses on retelling the plot or describing what happens in the book.,personal,Focuses on feelings,,FALSE
Not Quite Dead Yet,The StoryGraph,Mystery & Thriller,https://app.thestorygraph.com/book_reviews/3920f3cd-f2fb-4ef9-b9be-cda82067af1c,4.25,"The first 200-ish pages were slow and pretty boring, but then the plot twists and emotional moments starting coming in and that really added onto the rating of this book. The ending was so sad but I still enjoyed reading it, that's also one of the reasons I gave this book a higher review. Jet (the main character) was so funny and I found myself giggling at her comments many times. Guessed who the killer was but the writing and other shocking moments in the book were amazing.",summary_heavy,Focuses on retelling the plot or describing what happens in the book.,summary_heavy,Focuses on plot,,FALSE
Not Quite Dead Yet,The StoryGraph,Mystery & Thriller,https://app.thestorygraph.com/book_reviews/3920f3cd-f2fb-4ef9-b9be-cda82067af1c,3,"I found the writing style unique but distracting. The book felt bloated despite all the missing pronouns and articles, even in non-dialogue aspects. The characters felt much younger than their stated ages. But I enjoyed it overall, and I certainly couldn't have done a better job writing a book.

Oh, and the mother was a typical book mother -- absolutely detestable. But the closure at the end felt *chef's kiss* ",personal,Uses first-person language and references personal experiences or emotional reactions.,personal,Focuses on personal experience,,FALSE
Not Quite Dead Yet,LibraryThing,Mystery & Thriller,https://www.librarything.com/work/33011051/t/Not-Quite-Dead-Yet,3,"Margaret ""Jet"" Mason is twenty-seven years old, living back home with her wealthy parents in Woodstock, Vermont, and thoroughly stuck. She dropped out of law school, quit her banking job, and her life motto has always been ""I'll do it later."" She has time. Until Halloween night when an unknown intruder attacks her and leaves her for dead. Her childhood friend Billy Finney hears the family dog going berserk and kicks down the door just in time. At the hospital the news is devastating: a piece of her skull has lodged itself in her brain, and a fatal aneurysm is now inevitable. She has roughly seven days. A risky operation might extend her life but could kill her immediately — she refuses it, opting for the certainty of at least a few more days. Jet, who never thought of herself as having enemies, suddenly looks at everyone differently — her family, her former best friend who is now her sister-in-law, her ex-boyfriend, her neighbours. With Billy — the only person willing to help her and the one who saved her life — she sets out to solve her own murder before she runs out of time. Holly Jackson's first adult novel, from the author of A Good Girl's Guide to Murder which is now a Netflix series.

[May contain spoilers]
Jet's family wealth is the root of everything — the corruption, the secrets, the motive. The Mason family money has been built on financial crimes and the pain of others, and multiple people in Jet's orbit had reasons to want her dead connected to that. Sophia — someone close to Jet's family — has been deliberately poisoning Scott (who has kidney disease) by targeting his diet, a deeply insidious long-game scheme. Jet dies before solving the full mystery, actually blaming Billy in a panic in her final moments — which is both heartbreaking and a genuinely gutting narrative choice. But Jet leaves letters, and after her death Billy confronts the real killer on her behalf. The final perspective switch to Billy after Jet's death is where readers report completely falling apart — she dies in his arms, finally surrounded by someone who genuinely loves her, which contrasts with her isolated attack at the start. A Hollywood ticking-clock mystery with real emotional devastation underneath. GMA Book Club pick.

What I think: This is propulsive, clever, genuinely funny in places, and emotionally devastating in others — Jackson's trademark voice works just as well for adults as for YA. The ticking clock structure is irresistible. Jet dying before solving it herself, and Billy having to finish it for her, is a bold choice that pays off beautifully. You'll probably cry.

The only reason I gave this a 3 star and not higher, is because it felt very YA to me. The main character felt very young and it drove me insane. However, the plot and storyline of this is so good and enjoyable, so I just went with middle of the road. If the main character had actually sounded 27, then this probably would've been a 4.5 from me.",personal,Uses first-person language and references personal experiences or emotional reactions.,summary_heavy,Focuses on plot,,FALSE
Not Quite Dead Yet,LibraryThing,Mystery & Thriller,https://www.librarything.com/work/33011051/t/Not-Quite-Dead-Yet,5,"Not Quite Dead Yet' called to me partly because it's Holly Jackson's first explicitly non-YA book, partly because of the jaunty title and partly because of the premise: a woman who, left with seven days to live before an aneurysm incurred when she was attacked, kills her, decides to spend those days hunting her murderer. In a gruesome sort of way, it sounded fun.

I hadn't expected it to be such a powerfully emotional book. I'd thought that it would be plot/puzzle focused with a gimmick of 'See how clever I was to solve my own murder?' At first, that's what it seemed to be, but that was mostly a story the Jet was telling herself to keep her imminent death from feeling real.

There was a clever puzzle in the plot, with lots of secrets to uncover and suspects to investigate, but, for me, the most remarkable part of the book was watching Jet come to understand all that she was going to lose when she died. Murder victims often get marginalised in crime fiction. The focus moves, unsurprisingly perhaps, to the living: the investigators, the murderer and the survivors. Little time is spent on the loss the murdered person suffered. This book focuses on the murder victim.

At first, that focus is on the murder victim, Jet, as an amateur sleuth. In the few intense days she spends investigating her murder, she finally starts to embrace her life. She gets to see her family, her friends, her home town and, eventually, herself differently. She comes to understand how long she has been deferring living, waiting for her real life to begin.

What prevented this from being saccharine was that Jet wasn't a particularly nice person. She was clever, was often funny and was loved by some of the people around her. She was also unconscious of her own privilege, careless of the emotions of others and driven so much by a concept of what she thought her life ought to be that she paid little attention to what it actually was. Some of that is explained by the trauma of her older sister's unexpected death when Jet was a child. Some of it is just Jet being Jet.

Despite it jaunty title, 'Not Quite Dead Yet' is a deeply sad book, filled with tragedy, waste, guilt, selfishness and anger. It's not a story you can hold at arm's length.

Three things hits me the hardest: watching Jet understand too late the potential of the a relationship she's always kept in the friend zone, watching her lose trust in everyone around her as her pool of suspect s expands, and watching her frustration as her physical and mental state start to decline and her imminent death becomes real to her.

I recommend listening to the audiobook, narrated by Alex McKenna. She gives an extraordinary performance that matches the depth of emotions in the book. Click on the YouTube link below to hear a sample.",summary_heavy,Focuses on retelling the plot or describing what happens in the book.,analytical,Uses plot to support arguments,,TRUE
Not Quite Dead Yet,LibraryThing,Mystery & Thriller,https://www.librarything.com/work/33011051/t/Not-Quite-Dead-Yet,2.5,"After some heavy reads with complex themes, I decided to pick up some light reading. I chose this book because it has an interesting premise: someone solving her own murder.

Twenty-seven-year-old Jet Mason is violently attacked by an unseen intruder. She suffers a catastrophic head injury which her doctor tells her will trigger a deadly aneurysm within a week. Jet decides she wants to spend her remaining time solving her assault case which she knows will soon be upgraded to a murder case. She is assisted by her childhood friend, Billy Finney.

Unfortunately, from the beginning, I had difficulty suspending disbelief. Jet has major head trauma; the doctor tells her, “’you were comatose, had to be intubated. Suffered cardiac arrest from blood loss shortly after.” She had a fractured skull and had surgery and a lethal aneurysm looms, yet she leaves the hospital almost immediately after regaining consciousness. And the doctor’s only instruction is, “’Just change the dressings every day’”? Shortly afterwards, she starts slinging a sledgehammer. She starts losing feeling in various parts of her body, but she is able to physically exert herself in ways that would be daunting for someone healthy and fit?!

The other problem with Jet is her immaturity. She behaves like a bratty teenager rather than someone in her late twenties. She even runs away from home! She has no plan for her life. She’s always procrastinating, her favourite expression being, “’I’ll do it later.’” She blames others, like her dead sister and her demanding mother and her undemanding father, for her lack of accomplishments.

And then there’s Jet’s relationship with Billy. The entire thing seems so juvenile. Billy has had a crush on Jet since their childhood, but Jet doesn’t realize it? From the beginning, the author makes it so obvious that Billy is smitten. Does there have to be a romance element added? Can’t people just be friends?

The secondary characters tend to be one-dimensional. Virtually everyone is self-centred and unlikeable. Besides the person responsible for Jet’s attack, there’s at least one other murderer and an arsonist. One person should surely be charged with attempted murder and another should be charged with fraud. Women cheat or abandon families. Billy is one positive figure but the constant repetition of his need to help others becomes tedious.

Holly Jackson is best known as a YA author. Though this book is marketed as her first foray into adult fiction, my impression is that she continues to use the type of characterization and writing style that appeal to less sophisticated readers. The novel has an original premise, but its execution is unimaginative.",summary_heavy,Focuses on retelling the plot or describing what happens in the book.,analytical,Focuses on author's decisions,,FALSE
The Tenant,GoodReads,Mystery & Thriller,https://www.goodreads.com/book/show/221733727-the-tenant,4,"This wasn’t anything ✨life-changing✨ but FREIDA, girl, what are you lacing these books with? Because I physically could not put this down. Like… I had things to do. Responsibilities. And yet there I was, glued to the couch, eyes burning, fully invested in Blake Porter’s downward spiral.

Being a Scorpio and reading this? Oh, it’s personal. Everyone in this book dragged my sign through the mud and I took that personally. Like damn, let us breathe for ONE second.

Also… I LOVE watching men lose their minds. Blake unraveled so fast and I was living for it.

This was definitely better than her last one. Freida, you’re messy for this and I thank you. I was stressed, gasping, suspicious of everyone, and living for the chaos.",reactive,Expresses a strong opinion without supporting details or personal grounding.,reactive,Strong opinion,,FALSE
The Tenant,GoodReads,Mystery & Thriller,https://www.goodreads.com/book/show/221733727-the-tenant,3,"I’ll start by saying I personally think this is one of her better recent books—definitely an improvement over the last couple.
Not a top favorite, but still enjoyable enough to finish.

Part 1… Blake and Krista were, surprisingly, one of the more ""normal"" couples to emerge from Freida’s world—not necessarily the best or most likable, but yeah. Blake had his fair share of whining, which wore thin quickly, and Krista didn’t bring much to the table beyond her intense love for her goldfish and an almost compulsive cookie-baking habit. Whitney, on the other hand, was… intriguing, to say the least. The back-and-forth between her and Blake was entertaining at times, though it occasionally dragged. Still, things can only get more interesting from here—hopefully.

Part 2… The twist is revealed. Interesting… I guess. Not exactly earth-shattering. I wanted to love the whole when-where-why-how unraveling—but let’s be honest, I didn’t. That’s the thing with the thriller genre: there are only so many plot twists and tropes you can cycle through before it starts feeling like déjà vu with slightly different characters and a fresh coat of paint. But hey, I’m still here for the pure, ridiculous entertainment of it all. Maybe one day I’ll actually be caught off guard again — a person can dream. Still, I had a good laugh. That said, we definitely could’ve cut a few chapters without losing anything crucial. They didn’t really add much to the story.

And now Part 3… just a chaotic mess, honestly.

Finally, we’re at the epilogue. They’re usually hit or miss anyway—this one was fine, just didn’t feel all that necessary.

p.s. further exposure to limonene, fruit flies, or goldy the goldfish may result in emotional distress.

⇉ 𝘐𝘧 𝘺𝘰𝘶’𝘳𝘦 𝘯𝘦𝘸 𝘵𝘰 𝘵𝘩𝘪𝘴 𝘢𝘶𝘵𝘩𝘰𝘳, 𝘮𝘢𝘺𝘣𝘦 𝘪𝘵’𝘭𝘭 𝘩𝘪𝘵 𝘥𝘪𝘧𝘧𝘦𝘳𝘦𝘯𝘵. 𝘉𝘶𝘵 𝘧𝘰𝘳 𝘮𝘦, 𝘵𝘩𝘪𝘴 𝘰𝘯𝘦 𝘫𝘶𝘴𝘵 𝘥𝘪𝘥𝘯’𝘵 𝘣𝘳𝘪𝘯𝘨 𝘢𝘯𝘺𝘵𝘩𝘪𝘯𝘨 𝘯𝘦𝘸 𝘵𝘰 𝘵𝘩𝘦 𝘵𝘢𝘣𝘭𝘦. ⇇

↯

the cover? i like it.
the sypnosis? intriguing.
will it disappoint me? probably
will i still read it anyways? she seems to have me in a chokehold so yes, yes i will.",summary_heavy,Focuses on retelling the plot or describing what happens in the book.,summary_heavy,Focuses on plot,,FALSE
The Tenant,GoodReads,Mystery & Thriller,https://www.goodreads.com/book/show/221733727-the-tenant,1,the fish is the only normal character.,reactive,Expresses a strong opinion without supporting details or personal grounding.,reactive,Strong opinion,,FALSE
The Tenant,The StoryGraph,Mystery & Thriller,https://app.thestorygraph.com/book_reviews/9c6d4534-46e1-401a-b8f6-b4f6fa86ef58,3," This one wins for ""number of times they should've called 911 but didn't."" ",reactive,Expresses a strong opinion without supporting details or personal grounding.,reactive,Strong opinion,,FALSE
